<?xml version="1.0" encoding="UTF-8"?>
<!-- edited with XMLSPY v2004 rel. 2 U (http://www.xmlspy.com) by weed (jrsc) -->
<!--Sample XML file generated by XMLSPY v2004 rel. 2 U (http://www.xmlspy.com)-->
<SymLib xmlns="http://www.jurassic.com.cn/SymML.xsd" xmlns:xsi="http://www.w3.org/2001/XMLSchema-instance" xsi:schemaLocation="http://www.jurassic.com.cn/SymML.xsd 
符号库.xsd" name="" application="" author="">
	<Symbol id="0" fullname="父符号0/子符号0/孙子符号0" centerx="0" centery="0" width="100" height="100" zoomctrl="Zoom" rotatable="true" variablewidth="true" backcolor="0xffffffff">
		<SymText text="HaHa" x="0" y="0" fontsize="15" rotate="45" fontstyle="Regular" fontcolor="0xFF0000FF" fontname="宋体"/>
		<SymCurve bordercolor="0xff000000" type="Border" borderstyle="Solid" borderwidth="2" fillcolor="0xffffffff">
			<Point x="0" y="0"/>
			<Point x="50" y="50"/>
		</SymCurve>
		<SymArc type="Border" shape="Ellipse" borderstyle="DashDotDot" borderwidth="1" bordercolor="0xFFFF0000" fillcolor="0xFF0000FF" x="0" y="0" width="100" height="100" start="0" end="360" rotate="0" />
	</Symbol>
	<Symbol id="1" fullname="父符号1/子符号1" centerx="0" centery="0" width="100" height="100" zoomctrl="Zoom" rotatable="true" variablewidth="true" backcolor="0xffffffff">
		<Symbol fullname="" centerx="0" centery="0" width="50" height="50" zoomctrl="OriginalAspect" rotatable="true" variablewidth="true" backcolor="0xffffffff">
			<SymText text="不变形缩放，同步旋转" fontname="宋体" fontstyle="Regular" fontcolor="0xFF000000" fontsize="10" x="0" y="0" rotate="0" />
			<SymArc type="Both" shape="Ellipse" borderstyle="Solid" borderwidth="1" bordercolor="0xFFFF0000" fillcolor="0xFF0000FF" x="0" y="0" width="50" height="50" start="0" end="360" rotate="0" />
		</Symbol>
		<Frames>
			<Symbol fullname="" centerx="0" centery="0" width="50" height="50" zoomctrl="OriginalAspect" rotatable="true" variablewidth="true" backcolor="0xffffffff">
				<SymText text="不变形缩放，同步旋转" fontname="宋体" fontstyle="Regular" fontcolor="0xFF000000" fontsize="10" x="0" y="0" rotate="0" />
				<SymArc type="Both" shape="Ellipse" borderstyle="Solid" borderwidth="1" bordercolor="0xFFFF0000" fillcolor="0xFF0000FF" x="0" y="0" width="50" height="50" start="0" end="360" rotate="0" />
			</Symbol>
			<Symbol fullname="" centerx="0" centery="0" width="50" height="50" zoomctrl="OriginalAspect" rotatable="true" variablewidth="true" backcolor="0xffffffff">
				<SymText text="不变形缩放，同步旋转" fontname="宋体" fontstyle="Regular" fontcolor="0xFF000000" fontsize="10" x="0" y="0" rotate="0" />
			</Symbol>
		</Frames>
	</Symbol>
	<Symbol id="2" fullname="父符号2/子符号2" centerx="0" centery="0" width="100" height="100" zoomctrl="Zoom" rotatable="true" variablewidth="true" backcolor="0xffffffff">
		<Symbol fullname="" centerx="0" centery="0" width="50" height="50" zoomctrl="Zoom" rotatable="true" variablewidth="true" backcolor="0xffffffff">
			<SymText text="同步缩放，同步旋转" fontname="宋体" fontstyle="Regular" fontcolor="0xFF000000" fontsize="10" x="0" y="0" rotate="0" />
			<SymArc type="Border" shape="Ellipse" borderstyle="Solid" borderwidth="1" bordercolor="0xFFFF0000" fillcolor="0xFF0000FF" x="0" y="0" width="50" height="50" start="0" end="270" rotate="0" />
		</Symbol>
		<Frames>
			<Symbol fullname="" centerx="0" centery="0" width="50" height="50" zoomctrl="OriginalAspect" rotatable="true" variablewidth="true" backcolor="0xffffffff">
				<SymText text="同步缩放，同步旋转" fontname="宋体" fontstyle="Regular" fontcolor="0xFF000000" fontsize="10" x="0" y="0" rotate="0" />
			</Symbol>
			<Symbol fullname="" centerx="0" centery="0" width="50" height="50" zoomctrl="OriginalAspect" rotatable="true" variablewidth="true" backcolor="0xffffffff">
				<SymArc type="Border" shape="Ellipse" borderstyle="Solid" borderwidth="1" bordercolor="0xFFFF0000" fillcolor="0xFF0000FF" x="0" y="0" width="50" height="50" start="0" end="270" rotate="0" />
			</Symbol>	
		</Frames>
	</Symbol>
	<Symbol id="3" fullname="父符号3/子符号3" centerx="0" centery="0" width="100" height="100" zoomctrl="Zoom" rotatable="true" variablewidth="true" backcolor="0xffffffff">
		<Symbol fullname="" centerx="0" centery="0" width="50" height="50" zoomctrl="OriginalAspect" rotatable="false" variablewidth="true" backcolor="0xffffffff">
			<SymText text="不变形缩放，不同步旋转" fontname="宋体" fontstyle="Regular" fontcolor="0xFF000000" fontsize="10" x="0" y="0" rotate="0" />
			<SymArc type="Border" shape="Ellipse" borderstyle="Solid" borderwidth="1" bordercolor="0xFFFF0000" fillcolor="0xFF0000FF" x="0" y="0" width="50" height="50" start="0" end="360" rotate="0" />
			<SymCurve bordercolor="0xff000000" type="Both" borderstyle="Solid" borderwidth="2" fillcolor="0xffffffff">
			<Point x="-15" y="-20" />
			<Point x="0" y="0" />
			<Point x="0" y="10" />
			<Point x="10" y="-15" />
			<Point x="-15" y="-20" />
		</SymCurve>
		</Symbol>
	</Symbol>
	<Symbol id="4" fullname="父符号4/子符号4" centerx="0" centery="0" width="100" height="100" zoomctrl="Zoom" rotatable="true" variablewidth="true" backcolor="0xffffffff">
		<Symbol fullname="" centerx="0" centery="0" width="50" height="50" zoomctrl="Zoom" rotatable="false" variablewidth="true" backcolor="0xffffffff">
			<SymText text="同步缩放，不同步旋转" fontname="宋体" fontstyle="Regular" fontcolor="0xFF000000" fontsize="10" x="0" y="0" rotate="0" />
			<SymArc type="Border" shape="Ellipse" borderstyle="Solid" borderwidth="1" bordercolor="0xFFFF0000" fillcolor="0xFF0000FF" x="0" y="0" width="50" height="50" start="0" end="360" rotate="0" />
		</Symbol>
	</Symbol>
</SymLib>
